{
  "schema_version": "avila.core/evidence-claims/v0.2-draft",
  "semantic_profile": "avila.core/semantic/0.2-draft",
  "compiled_snapshot_sha256": "sha256:5cfda41aba2d14d137ca9e2200a35d4abba940abcf796640fec9004aa5b47f74",
  "claims": [
    {
      "claim_id": "dose",
      "step_id": "analyze",
      "output_slot": "dose_rate",
      "artifact": {
        "sha256": "sha256:abababababababababababababababababababababababababababababababab",
        "media_type": "application/vnd.fixture.quantity+json"
      },
      "claim": {
        "model": "interval",
        "lower": {
          "value": "90",
          "unit": "uSv/h"
        },
        "upper": {
          "value": "99",
          "unit": "uSv/h"
        }
      }
    },
    {
      "claim_id": "trace",
      "step_id": "analyze",
      "output_slot": "trace",
      "artifact": {
        "sha256": "sha256:abababababababababababababababababababababababababababababababab",
        "media_type": "application/vnd.fixture.analysis-trace+json"
      },
      "claim": {
        "model": "unquantified"
      }
    }
  ]
}
